id_competenza,id_abilita,descrizione
1630,51630,"Fornire indicazioni, linee guida, modelli e procedure derivate dalle norme nazionali e dalle direttive comunitarie, accertandosi che tali disposizioni siano applicate in modo corretto e uniforme in tutti i reparti aziendali"
1631,201631,"Verificare eventuali anomalie e discordanze nella trattazione dei dati amministrativi contabili"
1631,151631,"Supervisionare le operazioni di chiusura e le metodologie di redazione del bilancio nel rispetto delle norme civilistiche e fiscali"
1631,101631,"Supervisionare e definire l'utilizzo delle scritture di assestamento per passare dai valori di conto ai valori di bilancio e applicare i principi di valutazione in sede di predisposizione del bilancio d'esercizio"
1631,51631,"Impostare le metodologie per l'elaborazione di riclassificazioni ed il calcolo di indici di bilancio"
1632,251632,"Prospettare gli interventi migliorativi della gestione aziendale e le azioni correttive per la compensazione degli scostamenti negativi"
1632,201632,"Individuare le relazioni tra i dati rilevati, i fattori e le cause determinanti dei relativi scostamenti"
1632,151632,"Identificare gli scostamenti tra realizzato e programmato di variabili contabili ed extracontabili (tempi, quantità, valori)"
1632,101632,"Definire le caratteristiche e la struttura del reporting in funzione dei modelli di contabilità industriale prescelti o delle esigenze informative delle funzioni strategiche aziendali"
1632,51632,"Adottare le modalità di elaborazione e di presentazione del reporting differenziate in relazione a tempistica e destinatari"
1629,201629,"Valutare le caratteristiche dei software gestionali per la tenuta contabile nella relazione con fornitori e professionisti interni ed esterni"
1629,151629,"Pianificare e programmare (funzioni coinvolte e relativa tempistica) le attività amministrative contabili"
1629,101629,"Identificare e definire le istruzioni e le procedure operative per il trattamento contabile delle transazioni"
1629,51629,"Configurare l'architettura logica e strutturale del sistema contabile coerente con la tipologia produttiva d'impresa e le norme vigenti nazionali ed europee"
658,250658,"Organizzare l'esecuzione delle attività operative del magazzino minimizzando i tempi di attesa dei clienti e degli altri operatori"
658,200658,"Organizzare l'arrivo dei camion in entrata e in uscita ottimizzando l'utilizzo delle baie di carico"
658,150658,"Determinare la necessità di mezzi di movimentazione e spazi di magazzino"
658,100658,"Coordinare le risorse che svolgono attività operative impartendo direttive finalizzate al raggiungimento degli obiettivi di servizio"
658,50658,"Analizzare le richieste dei clienti relativamente alla preparazione degli ordini e alle tempistiche di spedizione al fine di definire le urgenze e le relative priorità"
660,50660,"Assicurare il trasporto dei prodotti nelle destinazioni stabilite con i clienti"
660,100660,"Dirigere le attività relative al collocamento dei materiali nel magazzino utilizzando le tecniche stabilite dalle procedure interne (allocazione per indice di rotazione, per riserva, random, ecc.)"
660,150660,"Monitorare lo svolgimento delle attività di magazzino utilizzando i principali indici caratteristici (l'utilizzo del F.I.F.O., la percentuale di saturazione, il numero di prodotti non movimentati, ecc.)"
660,250660,"Programmare la manutenzione dei mezzi e delle attrezzature di magazzino"
660,200660,"Organizzare le attività di ricevimento, immagazzinamento, picking, imballaggio e spedizione"
662,50662,"Assicurare la giusta corrispondenza tra la movimentazione di merce a magazzino e il sistema informatico (giornale di magazzino)"
662,100662,"Organizzare gli inventari assicurando la corretta attribuzione degli accertamenti positivi e negativi"
662,150662,"Organizzare l'archivio dei documenti di entrata e di uscita"
662,200662,"Organizzare le attività di controllo della merce al ricevimento ed effettuare la trasmissione della documentazione alla contabilità fornitori"
664,50664,"Assicurare la verifica del livello di servizio del trasporto quantificando i ritardi per area geografica"
664,100664,"Definire e condividere un sistema di procedure e istruzioni operative per ogni attività di magazzino specificando responsabilià e obiettivi"
664,200664,"Impostare e assicurare le attività di misurazione del livello di servizio per l'attività di preparazione degli ordini dei clienti"
664,150664,"Effettuare il controllo dei costi del magazzino e le attribuzioni ad ogni cliente"
664,250664,"Impostare e assicurare le attività per la misurazione del livello di servizio dall'ingresso delle merce fino alla disponibilità a scaffale per il prelievo"
664,300664,"Realizzare la reportistica per ogni cliente, garantendo la coerenza con quanto stabilito nello specifico contratto"
586,200586,"Comprendere le problematiche presenti in azienda, sia in riferimento all'organizzazione produttiva che al prodotto in funzione dell'organizzazione del lavoro e dell'elaborazione delle strategie aziendali"
586,250586,"Interagire con la proprietà e con gli altri addetti per creare un sistema di relazioni stabile e posivito"
586,150586,"Coadiuvare la proprietà nella definizione della strategia aziendale/mission in funzione della sua collocazione nel mercato di riferimento"
586,100586,"Analizzare le esigenze dei clienti dell'azienda e quelle dei potenziali nuovi clienti per migliorare la competitività"
586,50586,"Analizzare il mercato di riferimento dell'azienda, la situazione congiunturale e le prospettive nazionali e internazionali, contenstualmente all'andamento dell'azienda nella quale opera per definire la programmazione produttiva"
586,300586,"Pianificare incontri con i vertici aziendali per la definizione della strategia aziendale e la soluzione delle problematiche"
586,350586,"Pianificare le fermate per la manutenzione programmata, in rapporto all'organizzazione produttiva e alle performance dei macchinari, alle risorse umane disponibili e alla stagionalità del mercato"
593,200593,"Gestire il rapporto con il sindacato per creare un positivo clima nelle relazioni sindacali funzionale all'attività produttiva, nel rispetto delle indicazioni della proprietà"
593,250593,"Organizzare l'attività degli addetti, gli orari e i turni di lavoro per l'ottimizzazione del sistema produttivo"
593,300593,"Valutare il bisogno di manodopera necessaria per l'esecuzione delle fasi produttive per il rispetto dei tempi di consegna del prodotto"
593,150593,"Gestire il piano ferie e permessi degli addetti alla produzione in funzione delle necessità produttive, nel rispetto delle pianificazione e delle strategie aziendali"
593,100593,"Gestire gli eventuali imprevisti nella gestione del personale, attraverso il ricorso a rimpiazzi o al lavoro straordinario"
593,50593,"Gestire e programmare l'attività e i riposi del personale addetto durante la fermate obbligatorie"
598,350598,"Valutare le caratteristiche tecniche e qualitative del prodotto in funzione del mercato di riferimento"
598,300598,"Valutare la professionalità e l'impegno del personale per migliorare la qualità e le condizioni di lavoro"
598,250598,"Valutare la professionalità dei fornitori, la qualità del lavoro/servizio e il rispetto dei tempi"
598,200598,"Valutare la potenzialità degli impianti, al fine di proporre investimenti in attrezzature e macchinari"
598,150598,"Valutare il grado di soddisfazione del personale aziendale nello svolgimento delle proprie mansioni"
598,100598,"Valutare il grado di soddisfazione dei clienti"
598,50598,"Progettare modifiche o cambiamenti delle strategie aziendali in relazione ai risultati ottenuti"
599,400599,"Monitorare l'andamento del processo produttivo nel suo complesso attraverso gli strumenti e le procedure aziendali, quali ad esempio software dedicati"
599,450599,"Pianificare le attività legate alla produzione, necessarie per ottimizzare tutte le risorse aziendali, in funzione della stagionalità del mercato"
599,500599,"Valutare le necessità di approvvigionamento della materia prima, delle forniture/subforniture e dei componenti il prodotto finito, in funzione della programmazione produttiva"
599,350599,"Intervenire per approntare modifiche nel processo produttivo relativamente all'utilizzo dei macchinari funzionalmente all'ottimizzazione della capacità produttiva"
599,300599,"Intervenire per apportare modifiche nel processo di trasformazione della materie prime e/o dei semilavorati in lavorazione"
599,250599,"Impiegare i sistemi di programmazione e controllo aziendali in maniera corretta"
599,200599,"Assicurare la realizzazione della produzione in ordine alle specifiche tecniche richieste dal cliente"
599,150599,"Assicurare l'applicazione e il rispetto dei dispositivi di legge in termini di sucurezza e salute nei luoghi di lavoro"
599,100599,"Assicurare il rispetto dei tempi di produzione e consegna del prodotto"
599,50599,"Armonizzare le distinte fasi produttive e l'attività dei vari reparti aziendali"
1722,51722,"Dialogare con l'ufficio acquisti al fine di concordare modalità e tempistica"
1722,101722,"Dialogare con l'ufficio vendite al fine di organizzare la presenza di prodotti in uscita"
1722,151722,"Gestire tempi di acquisto di materiali e componenti"
1722,251722,"Organizzare il layout relativo alla localizzazione di materiali e componenti"
1722,201722,"Interloquire con lo spedizioniere interno o esterno"
1722,301722,"Programmare gli arrivi e le partenze di materiali, in collaborazione con gli uffici acquisti e vendite"
1721,101721,"Individuare i fornitori più adatti alle esigenze dell'impresa"
1721,51721,"Gestire tempi e modalità di acquisto di materiali e componenti"
1721,151721,"Raccogliere e organizzare i fabbisogni di materiali e strumenti espressi dai reparti, garantendo 'la disponibilità'"
1721,201721,"Valutare le offerte prestazionali ed economiche dei fornitori al fine di individuare la più rispondente alle necessità dell'impresa"
1718,151718,"Interagire con i tencici di produzione al fine di coglierne le necessità"
1718,101718,"Definire tempi e modalità delle diverse fasi produttive"
1718,51718,"Coordinare i diversi reparti produttivi in accordo ai piani di produzione"
1718,201718,"Organizzare il coinvolgimento di eventuali fornitori e subfornitori a livello di modalità e tempistica"
1718,251718,"Suddividere i contenuti dell'ordine sulla base delle diverse fasi produttive"
1720,101720,"Interpretare i contenuti dell'ordine e tradurli in programma produttivo"
1720,51720,"Gestire i rapporti interpersonali a monte e a valle e con i livelli di responsabilità"
1720,151720,"Organizzare il coinvolgimento di eventuali fornitori e subfornitori a livello di modalità e tempistica"
1720,201720,"Suddividere i contenuti dell'ordine sulla base delle diverse fasi produttive"
1720,251720,"Valutare i tempi di produzione per programmare l'acquisto di materiali e componenti"
1389,151389,"Supportare le agenzie nella definizione del profilo professionale delle risorse aggiuntive necessarie per la realizzazione del piano di vendita, al fine di mettere in atto le procedure di ricerca e selezione del personale mancante"
1389,101389,"Supportare gli agenti nella ricerca, selezione e inserimento di nuovi collaboratori di vendita, al fine del completamento del piano di sviluppo organizzativo e professionale stabilito"
1389,51389,"Individuare le esigenze di formazione degli agenti e dei loro collaboratori per pianificare, progettare e realizzare le attività formative"
1390,351390,"Supportare le attività agenziali rivolte alla definizione di obiettivi, alla verifica dell'attuazione dei piani di lavoro e al controllo dei risultati dei collaboratori di vendita"
1390,301390,"Supportare le agenzie nella definizione ed uso di indicatori e modelli di simulazione dei costi e della redditività dell'azione di vendita, al fine di valutare la convenienza operativa dei programmi di crescita commerciale e organizzativa predisposti e realizzati"
24012405001,24100001,"Applicare tecniche di coinvolgimento dei clienti"
1390,251390,"Seguire la realizzazione delle iniziative commerciali centralizzate da parte dei punti vendita, incluso le azioni di riforma centralizzate"
1390,201390,"Realizzare iniziative promozionali a carattere locale, in collaborazione con il gruppo di venditori, dipendenti o autonomi, che opera nella zona finalizzate al conseguimento degli obiettivi di sviluppo contenuti nel programma commerciale dell'impresa"
1390,151390,"Programmare l'attività dei venditori diretti coordinandone l'impegno e verificandone i risultati, al fine di assicurarne l'apporto previsto alla realizzazione del programma commerciale di zona, sostenendone la motivazione e individuando le azioni correttive da realizzare in caso di scostamento dai risultati attesi"
1390,101390,"Negoziare gli obiettivi di vendita con la rete agenziale per realizzare una corretta ripartizione territoriale degli obiettivi contenuti nel programma commerciale dell'impresa mandante"
1390,51390,"Fornire assistenza agli agenti per la stipula di convenzioni aziendali per aumentare le opportunità del mercato locale e favorire lo sviluppo delle potenzialità della relazione commerciale già in atto con le aziende clienti"
1386,251386,"Sviluppare il piano di attività organizzative e di iniziative di vendita necessario a conseguire gli obiettivi del programma commerciale"
1386,201386,"Supportare l'agente nella progettazione e realizzazione di un sistema gestionale di monitoraggio dell'azione di vendita, in grado di individuare gli scostamenti dai risultati attesi e di fornire inidcazioni per apportare i correttivi necessari al raggiungimento degli obiettivi di vendita"
1386,151386,"Individuare gli obiettivi di vendita conseguibili nel territorio di competenza, sulla base dell'analisi effettuata, al fine di determinare il programma commerciale di zona"
1386,101386,"Analizzare le potenzialità del territorio di pertinenza per individuare i settori di penetrazione commerciale più favorevoli alla realizzazione degli obiettivi di vendita in relazione al potenziale professionale degli addetti, al portafoglio prodotti dell'azienda ed agli obiettivi di redditività"
1386,51386,"Analizzare il portafoglio clienti in essere per sviluppare il programma delle attività di riforma dei contratti in corso e le attività di cross selling, al fine di determinarne l'apporto al piano vendite e formulare gli obiettivi di crescita e redditività aziendali"
1387,201387,"Quantificare le risorse necessarie alla realizzazione degli obiettivi di attività di vendita al fine di elaborare il piano di sviluppo organizzativo e professionale necessario"
1387,151387,"Determinare il quadro dei costi e dei ricavi ed individuare gli incrementi di redditività conseguibili dai punti vendita e dall'impresa"
1387,101387,"Determinare gli obiettivi di attività necessari alla realizzazione del piano di vendita"
1387,51387,"Analizzare la rete agenziale nelle sue componenti organizzative e professionali per determinare il suo potenziale di vendita"
24012405001,24100006,"Applicare tecniche per creare e gestire interazioni attraverso i Social"
24012405001,24100007,"Utilizzare le preferenze degli utenti"
24012405001,24100008,"Applicare tecniche di social media planning"
24012405001,24100009,"Utilizzare i principali social media"
24012405001,24100010,"Utilizzare software di comunicazione istantanea"
24012405002,24100011,"Applicare tecniche di analisi dei costi"
24012405002,24100012,"Applicare tecniche di pianificazione delle attività"
24012405002,24100013,"Applicare tecniche di coinvolgimento dei clienti"
24012405002,24100014,"Utilizzare le preferenze degli utenti"
24012405002,24100015,"Utilizzare i principali social media"
24012405002,24100016,"Applicare tecniche per pianificare e gestire blog e chat"
24012405002,24100017,"Applicare tecniche di social media planning"
24012405002,24100018,"Applicare tecniche di comunicazione"
24012405002,24100019,"Applicare tecniche di misurazione delle vanity metrics (like,"
24012405002,24100020,"share, comment)"
24012405002,24100021,"Applicare tecniche di valutazione delle vanity metrics (like,"
24012405002,24100022,"share, comment) attraverso gli insight dei Social"
24012405002,24100023,"Leggere e interpretare gli insight"
24012405002,24100024,"Applicare tecniche di lavoro di gruppo"
24012405002,24100025,"Applicare tecniche di benchmarking"
24012405002,24100026,"Applicare tecniche di analisi della concorrenza"
24012405002,24100027,"Utilizzare software per i fogli elettronici "
24012405003,24100028,"Utilizzare tecniche di pianificazione economica e controllo dei costi"
24012405003,24100029,"Applicare tecniche di misurazione delle vanity metrics (like, share, comment)"
24012405003,24100030,"Applicare tecniche di valutazione delle vanity metrics attraverso gli insight dei Social"
24012405003,24100031,"Applicare tecniche di comunicazione"
24012405003,24100032,"Applicare strategie di comunicazione"
24012405003,24100033,"Applicare tecniche di benchmarking"
24012405003,24100034,"Applicare tecniche di analisi della concorrenza"
24012405003,24100035,"Utilizzare software per i fogli elettronici"
24012405003,24100036,"Applicare tecniche per gestire situazioni di crisis management applicate al web"
24012405003,24100037,"Applicare tecniche di social media planning"
24012405003,24100038,"Applicare tecniche di ottimizzazione delle pagine web"
24012405003,24100039,"Utilizzare le preferenze degli utenti"
24012405003,24100040,"Presidiare e gestire la reputazione aziendale"
1665,101665,"Approntare soluzioni per il ripristino delle condizioni di funzionamento in qualità"
1665,51665,"Analizzare e progettare un processo organizzativo in funzione del CQ"
1665,151665,"Effettuare il confronto tra le analisi e le specifiche del prodotto"
1665,301665,"Individuare le disfunzioni significative presenti all'interno di un processo produttivo e riconoscerne le cause"
1665,251665,"Impostare programmare ed seguire il collaudo conclusivo sul prodotto finito"
1665,201665,"Impostare programmare ed seguire i collaudi e i controlli atti a verificare e garantire la qualità dei processi"
1665,401665,"Prefigurare azioni correttive necessarie a mantenere gli standard di qualità definiti"
1665,351665,"Leggere e tradurre operativamente i risultati delle analisi qualitative e quantitative"
1665,501665,"Relazionare con i fornitori per assicurare il mantenimento delle caratteristiche di qualità dei prodotti acquisiti"
1665,451665,"Realizzare misurazioni, prove e controlli con strumentazioni tradizionali e computerizzate"
1666,101666,"Definire la banca dati relativa alla qualità a supporto delle analisi statistiche relative ai guasti, scarti di lavorazione, ecc."
1666,51666,"Attuare in azienda i requisiti previsti per portare/conservare l'azienda in certificazione di qualità"
1666,201666,"Determinare le variabili ed i parametri di un sistema informativo utile per la gestione della qualità in azienda"
1666,151666,"Definire la modulistica relativa alla certificazione e controllo della qualità"
1666,301666,"Impostare un sistema per la valutazione e il monitoraggio delle attività in funzione delle politiche di qualità"
1666,251666,"Elaborare il manuale della qualità contenente la normativa per il rispetto delle specifiche di qualità"
1666,401666,"Realizzare il reporting dei controlli effettuati"
1666,351666,"Promuovere la diffusione a tutto il personale di ogni livello della politica di qualità dell'azienda, verificandone la comprensione, la realizzazione, l'aggiornamento"
1664,101664,"Definire i metodi statistici per la raccolta e l'elaborazione dei dati"
1664,51664,"Applicare le tecniche statistiche di base per il controllo di qualità"
1664,201664,"Organizzare dati sperimentali sugli approvvigionamenti, sui prodotti e sui processi produttivi da analizzare"
1664,151664,"Gestire l'analisi dei risultati ottenuti dalle elaborazioni fatte sui dati raccolti"
1664,251664,"Presentare elaborazioni sintetiche e significative dei dati raccolti"
1664,301664,"Scegliere il campione statistico su cui effettuare le analisi"
1663,51663,"Definire gli interventi da effettuare e realizzare un piano di attività di CQ"
1663,101663,"Definire le politiche e gli obiettivi di qualità aziendale individuando le specifiche principali relative alle attività di CQ e verificandone la coerenza con le altre politiche ed obiettivi aziendali"
1663,151663,"Interagire con la funzione di progettazione per interpretare le richieste del cliente e trasformarle in specifiche di prodotto"
1663,251663,"Programmare gli interventi di manutenzione ordinaria e straordinaria degli strumenti per il CQ"
1663,201663,"Progettare le azioni di miglioramento a supporto del CQ"
1663,351663,"Valutare i costi della qualità ed i costi della non-qualità ed effettuare l'analisi della convenienza economica"
1663,301663,"Programmare le scadenze temporali delle diverse attività di CQ"
1663,401663,"Valutare le diverse metodologie e strumenti per il CQ"
25012403401,24100120,"Ricorrere a tecniche di analisi del segnale sonoro e trattamenti normalmente impiegati per migliorare la qualità del segnale"
1943,201943,"Tessere una rete relazionale stabile con centri di ricerca e imprese"
25012403401,24100121,"Utilizzare attrezzature e metodologie impiegate per le intercettazioni di segnali sonori"
25012403401,24100122,"Utilizzare tutti gli strumenti di ascolto e trascrizione"
25012403402,24100123,"Differenziare i vari momenti della procedura: i ruoli delle singole parti e i passi procedurali da compiere durante l'espletamento dell'incarico"
25012403402,24100124,"Esporre i contenuti dell'elaborato servendosi di specifica terminologia, in coerenza con quanto richiesto dall'interlocutore, soprattutto nei rapporti con il committente e con le parti interessate"
25012403402,24100125,"Intrattenere le relazioni sociali all'interno del contesto operativo in ambito forense"
25012403403,24100126,"Analizzare, contestualizzandola, una conversazione, riconoscendo intonazioni che cambiano il significato delle singole parole, ruoli all'interno del dialogo, verità o menzogne"
25012403403,24100127,"Effettuare le operazioni di trascrizione in forma scritta tenendo conto della complessità del linguaggio all'interno di un segnale vocale registrato nel rispetto delle procedure specifiche in ambito forense ed investigativo"
25012403403,24100128,"Ricostruire una realtà, un accadimento o un evento attraverso l'ascolto globale di una registrazione, riportando su carta tutto ciò che completa una scena come rumori di fondo o altro"
25012403403,24100129,"Trasferire su supporto cartaceo le caratteristiche sovrasegmentali proprie del parlato orale e spontaneo utilizzando tecniche e simboli semplici"
1944,101944,"Capire e mettere in comunicazione le aspettative di ricercatori e imprese"
1944,51944,"Analizzare scenari complessi proponendo soluzioni semplici"
1944,151944,"Creare buoni rapporti personali con i clienti, i colleghi e i collaboratori"
1944,201944,"Fare da intermediario negli accordi economici tra le parti"
1942,51942,"Elaborare un piano di sviluppo per la valorizzazione dell'innovazione all'interno dell'impresa"
1942,101942,"Elaborare un'analisi dei rischi e dei benefici che si possono verificare durante il processo di applicazione della nuova tecnologia al mercato"
1942,151942,"Gestire gli aspetti finanziari dei progetti sull'innovazione a seguito di una corretta pianificazione delle varie fasi di progetto"
1942,201942,"Utilizzare software manageriali per effettuare correttamente le operazioni"
1941,51941,"Analizzare il potenziale di mercato di un determinato prodotto/innovazione/invenzione e il suo posizionamento"
1941,101941,"Comprendere e gestire il budget finalizzato allo sviluppo di un piano di lancio di un prodotto e alla creazione di una nuova impresa"
1941,201941,"Definire le modalità di fund raising, di ricerca partner e di ricerca sponsor per sviluppare un piano di lancio di un nuovo prodotto"
1941,151941,"Condurre ricerche sui Database Brevetti"
1941,251941,"Effettuare un'analisi finanziaria"
1941,351941,"Orientare i ricercatori al soddisfacimento delle richieste di mercato"
1941,301941,"Elaborare un report che contenga una strategia di vendita"
1941,401941,"Valutare la migliore soluzione di protezione per una certa innovazione"
220,150220,"Favorire i rapporti di collaborazione del personale coinvolto sul progetto di comunicazione (gestione del gruppo di lavoro)"
220,100220,"Coordinarsi con i reparti creativi dell'agenzia utilizzando il momento di 'briefing' in modo intelligente e creativo"
220,50220,"Comprendere le esigenze concrete di ciascun reparto impegnato nella produzione delle attività previste nel Piano di Comunicazione, per fornire indicazioni e supporto operativo alla loro realizzazione"
220,250220,"Gestire i rapporti con una molteplicità di figure professionali (creativo, copywriter, grafico, fotografo, programmatore web, regista) trasmettendo il messaggio concordato con il Cliente"
220,200220,"Gestire e controllare le attività di produzione intermedie, attraverso la definizione degli ambiti di trasmissione e le scadenze temporali"
220,300220,"Selezionare attraverso l'impiego di adeguate procedure e metodologie gli strumenti idonei ad accompagnare la comunicazione definita per lo specifico Cliente"
219,150219,"Individuare gli strumenti e i mezzi operativi e tecnologici presenti sul mercato, utilizzabili per la realizzazione del piano di comunicazione in funzione delle loro caratteristiche tecniche, del loro grado di diffusione e di impatto sul target"
219,100219,"Definire per tempi, costi e caratteristiche comunicative, il piano di comunicazione e/o le attività promozionali in funzione delle esigenze del Cliente"
219,50219,"Controllare i costi e i tempi di realizzazione delle varie fasi operative"
