id_competenza,id_abilita,descrizione
24010102101,1100104,"Pianificare ed organizzare un cantiere didattico in relazione agli interventi selvicolturali oggetto di esecuzione e di apprendimento"
24010102101,1100105,"Predisporre e verificare il corretto allestimento del cantiere didattico "
24010102101,1100106,"Approntare e verificare la predisposizione delle attrezzature idonee all'intervento formativo"
24010102101,1100107,"Coordinare l'equipe didattica"
24010102101,1100108,"Trasferire nozioni a carattere teorico pratico relative ai principi di organizzazione logistica di un cantiere didattico"
24010102101,1100109,"Utilizzare la dotazione tecnico didattica di supporto per le attività formative"
24010102101,1100110,"Monitorare l'adozione di prassi operative sicure ed ergonomiche nello svolgimento delle attività"
24010102102,1100104,"Pianificare ed organizzare un cantiere didattico in relazione agli interventi selvicolturali oggetto di esecuzione e di apprendimento"
24010102102,1100112,"Predisporre e verificare il corretto allestimento del cantiere didattico"
24010102102,1100106,"Approntare e verificare la predisposizione delle attrezzature idonee all'intervento formativo"
24010102102,1100107,"Coordinare l'equipe didattica"
24010102102,1100108,"Trasferire nozioni a carattere teorico pratico relative ai principi di organizzazione logistica di un cantiere didattico"
24010102102,1100109,"Utilizzare la dotazione tecnico didattica di supporto per le attività formative"
24010102102,1100110,"Monitorare l'adozione di prassi operative sicure ed ergonomiche nello svolgimento delle attività"
24010102103,1100118,"Identificare prassi operative sicure/ergonomiche per assicurare la corretta funzionalità degli strumenti in uso"
24010102103,1100119,"Supervisionare le operazioni di manutenzione di macchinari ed attrezzature"
24010102103,1100120,"Monitorare la disponibilità di materiali, attrezzature e macchinari"
24010102103,1100121,"Identificare il livello di usura e idoneità residua di attrezzature e utensili valutandone le possibili modalità di ripristino/sostituzione"
24010102103,1100122,"Riconoscere lo stato di efficienza delle macchine valutandone la prestazione e il grado di funzionalità "
24010102103,1100123,"Applicare procedure di ricerca guasti e/o malfunzionamenti"
24010102104,1100124,"Identificare i fabbisogni formativi"
24010102104,1100125,"Pianificare gli interventi formativi in relazione alle necessità presentate dai discenti"
24010102104,1100126,"Gestire gruppi di apprendimento in contesti operativi"
24010102104,1100127,"Gestire processi formativi volti a trasferire nozioni a carattere teorico pratico in ambito forestale"
24010102104,1100128,"Utilizzare gli strumenti tecnico didattici di supporto allo svolgimento delle attività formative in relazione ai diversi oggetti di apprendimento ed ai diversi contesti in cui si sviluppano le attività"
24010102104,1100129,"Utilizzare tecniche e strumenti di valutazione dell'apprendimento"
24010102104,1100130,"Monitorare e valutare le diverse dimensioni di qualità di un intervento formativo"
24010102105,1100131,"Effettuare l'abbattimento delle piante, sulla base delle verifiche preliminari all’interno di popolamenti forestali in condizioni normali e/o speciali,   ealizzando i tagli mediante l'utilizzo delle tecniche e delle attrezzature dedicate (es. motosega, tirfor, martinetto idraulico, fascia serra tronchi, ecc.)"
24010102105,1100132,"Effettuare l'allestimento delle piante abbattute direttamente sul letto di caduta, provvedendo alla sramatura e alla depezzatura"
24010102106,1100133,"Eseguire la manutenzione ordinaria della motosega, realizzando il controllo, la  pulizia e la verifica dei DPI"
24010102107,1100134,"Eseguire la movimentazione dei tronchi o delle piante intere, provvedendo al  zoncentramento nelle zona di raccolta, al trasporto fino all'imposto e al carico sui veicoli destinati al trasporto"
24010102108,1100135,"Esecuzione della operazioni di manutenzione di macchinari e attrezzature"
24010102109,1100136,"Saper verificare l'idoneità di attrezzature, macchinari e DPI "
24010102109,1100137,"Saper organizzare le risorse (umane e strumentali)."
24010102110,1100136,"Saper verificare l'idoneità di attrezzature, macchinari e DPI "
24010102110,1100137,"Saper organizzare le risorse (umane e strumentali)."
24010102111,1100136,"Saper verificare l'idoneità di attrezzature, macchinari e DPI "
24010102111,1100137,"Saper organizzare le risorse (umane e strumentali)."
24010102201,1100001,"Applicare tecniche per il pareggiamento delle famiglie, la creazione di nuovi nuclei e il popolamento degli alveari"
24010102201,1100002,"Utilizzare le modalità di collocazione a dimora e gestione dell'arnia, mantenendola in condizioni di igiene e di sicurezza adeguate"
24010102201,1100003,"Valutare e scegliere l'ubicazione e il dimensionamento dell'apiario sulla base di specifici requisiti (presenza di fonti nettarifere e pollinifere, orientamento, stagione, ecc.)"
24010102201,1100004,"Selezionare la tipologia di arnia e applicare le tecniche di costruzione per accogliere la colonia di api"
24010102201,1100005,"Utilizzare tecniche e strumenti per il processo di selezione delle api migliori Utilizzare tecniche di riconoscimento dell'ape regina"
24010102201,1100006,"Utilizzare criteri e tecniche di osservazione dello sviluppo dell'arnia in funzione del periodo e delle condizioni ambientali"
24010102202,1100007,"Identificare lo stato di salute dell'apiario e delle api, riconoscendo eventuali patologie in essere"
24010102202,1100008,"Adottare le misure di profilassi e terapia atte a garantire lo stato di salute delle api utilizzando in sicurezza i prodotti necessari e autorizzati"
24010102202,1100009,"Applicare procedure di somministrazione dei prodotti profilattici e terapeutici nel rispetto dei tempi di residuo e di smielatura per evitare contaminazioni del prodotto"
24010102202,1100010,"Riconoscere le diverse tipologie di intervento di profilassi o di terapia da realizzare, al fine di somministrare i prodotti idonei nei tempi e nelle modalità previste"
24010102202,1100011,"Adottare procedure, protocolli, tecniche di igiene, pulizia e riordino degli ambienti e delle attrezzature dell'alveare nel rispetto delle normative vigenti"
24010102203,1100012,"Identificare le arnie migliori per la produzione di miele in base a specifiche caratteristiche fisico/visive"
24010102203,1100013,"Individuare il periodo più idoneo per l'estrazione e lo stoccaggio dei melari, utilizzando in sicurezza l'attrezzatura e gli strumenti adeguati"
1777,301777,"Svolgere il lavoro di allenamento richiesto dal responsabile"
24010102306,1100051,"Scegliere i prodotti più adatti in relazione al tipo di erbe e piante da trattare"
24010102203,1100014,"Utilizzare tecniche e strumenti (soffiatore, apiscampi) di estrazione del miele – Applicare tecniche manuali o meccaniche per le diverse fasi di lavorazione (disopercolatura, smielatura, centrifugazione, maturazione, filtraggio, ecc.), utilizzando in sicurezza gli strumenti e i macchinari specifici e rispettando i tempi di lavorazione"
24010102203,1100015,"Adottare procedure e tecniche per la raccolta dei diversi prodotti apistici"
24010102203,1100016,"Adottare le tecniche di conservazione dei prodotti apistici tenendo conto delle diverse tipologie e caratteristiche"
24010102203,1100017,"Riconoscere le caratteristiche fisiche, biologiche e organolettiche del miele e dei prodotti apistici sulla base di analisi visive, olfattive, gustative"
24010102203,1100018,"Applicare la metodologia corretta per svolgere le analisi previste e classificare il miele in base al polline prevalente e alle sue caratteristiche fisico-chimiche e organolettiche (fluidità, cristallizzazione, ecc.)"
24010102204,1100019,"Caratteristiche e modalità di funzionamento dei macchinari per il confezionamento dei prodotti apistici (imbottigliamento, invasettamento, riempimento, tappatura, ecc.)"
24010102204,1100020,"Principali caratteristiche fisiche e biologiche dei prodotti da confezionare"
24010102204,1100021,"Tipologie e caratteristiche dei materiali utilizzati per il confezionamento (vetro, plastica, pet, tetrapak, ecc.)"
24010102204,1100022,"Metodi di stoccaggio e conservazione del miele e degli altri prodotti apistici"
24010102204,1100023,"Requisiti igienico-sanitari degli ambienti di produzione e stoccaggio"
24010102204,1100024,"Tecniche e procedure di sanificazione degli impianti"
24010102204,1100025,"Principali riferimenti legislativi e normativi in materia di HACCP"
24010102204,1100026,"Principali disposizioni normative in materia di confezionamento, etichettatura e tracciabilità/rintracciabilità dei prodotti alimentari"
24010122201,1100138,"Valutare lo stato di efficienza dei macchinari e dei suoi componenti "
24010122201,1100139,"Adottare tecniche di preparazione del carico, aggancio, scarico e realizzazione delle cataste "
24010122201,1100140,"Identificare le prassi operative sicure/ergonomiche nel concentramento manuale o meccanico e accatastamento del legname "
24010122201,1100141,"Utilizzare in sicurezza macchinari e impianti atti alla movimentazione e all'esbosco (smacchio) sia per via terrestre sia per via aerea"
24010122201,1100142,"Individuare i rischi ed adottare le necessarie misure di sicurezza per le operazioni di abbattimento, allestimento ed esbosco "
24010122201,1100143,"Lavorare in squadra per la corretta organizzazione del cantiere forestale"
24010122202,1100144,"Utilizzare in sicurezza gli strumenti da taglio con particolare riferimento alla motosega "
24010122202,1100145,"Applicare tecniche e procedure di taglio, abbattimento e atterramento "
24010122202,1100146,"Adottare tecniche di manutenzione delle attrezzature e affilatura degli strumenti da taglio"
24010122202,1100147,"Utilizzare tecniche di sramatura e depezzatura di piante da piccole a grandi dimensioni "
24010122202,1100148,"Pianificare ed eseguire la manutenzione ordinaria delle attrezzature di lavoro"
24010122203,1100149,"Riconoscere le caratteristiche delle zone boschive per impiantare più agevolmente il cantiere "
24010122203,1100150,"Applicare il piano dei tagli, la simbologia e la sua contestualizzazione sul terreno"
24010122203,1100151,"Controllare lo stato delle attrezzature, dei macchinari e dei DPI da utilizzare "
24010122203,1100152,"Applicare tecniche di delimitazione e segnalazione del cantiere boschivo e di tracciamento delle linee di esbosco e di fuga"
24010102001,1100063,"Programmare le potature delle piante nei periodi vegetativi migliore per la pianta per non compromettere la risposta delle essenze vegetali "
24010102001,1100064,"Scegliere quali rami e branche tagliare in relazione al tipo di intervento richiesto (potatura di formazione, potatura di allevamento, sviluppo produttivo ecc)"
24010102001,1100065,"Verificare che l'intervento di potatura anche in altezza (tree climbing) e l'utilizzo delle attrezzature avvenga in condizioni di sicurezza per gli operatori"
24010102001,1100066,"Curare pulizia e manutenzione ordinaria degli attrezzi utilizzati per la potatura"
24010102001,1100067,"Eseguire le operazioni di legatura, sanificazione, raccolta dei residui sulla base delle esigenze della pianta e delle disposizioni dell'impresa"
24010102002,1100068,"Curare la messa a riposo delle macchine agricole e forestali "
24010102002,1100069,"Effettuare controlli pre-utilizzo riconoscendo i guasti ed i malfunzionamenti dei macchinari e delle attrezzature utilizzate in ambito agricolo e forestale"
24010102002,1100070,"Eseguire interventi di manutenzione ordinaria in condizioni di sicurezza "
24010102002,1100071,"Maneggiare ed utilizzare le principali attrezzature e macchine in condizioni di sicurezza "
24010102002,1100072,"Pianificare le operazioni di utilizzo delle macchine agricole e forestali "
24010102002,1100073,"Utilizzare le macchine nel rispetto delle norme di sicurezza "
24010102002,1100042,"Utilizzare secondo le prescrizioni le attrezzature specifiche per movimentazione carichi elencate nella normativa"
24010102003,1100075,"Applicare tecniche di sramatura e depezzatura sia in condizioni normali che difficili rispettando gli standard di sicurezza nell'impiego di motoseghe e attrezzi forestali"
24010102003,1100076,"Applicare tecniche di abbattimento sia in condizioni normali che difficili rispettando gli standard di sicurezza nell'impiego di motoseghe e attrezzi forestali"
24010102003,1100077,"Applicare tecniche di stima delle distanze e delle altezze delle piante "
24010102003,1100078,"Monitorare e manutenere gli spazi ed i viali parafuoco "
24010102003,1100079,"Monitorare e manutenere la pulizia degli alvei e degli argini di fiumi e torrenti, nonché di canali di deflusso delle acque meteoriche "
24010102003,1100042,"Utilizzare secondo le prescrizioni le attrezzature specifiche per movimentazione carichi elencate nella normativa"
24010102004,1100081,"Eseguire la ceppatura delle piante forestali per aumentarne il vigore vegetativo "
24010102004,1100082,"Eseguire l'esbosco delle piante e la triturazione di foglie e rami sottili provenienti dalle operazioni di potatura, ceppatura, ecc., al fine di trattare i rifiuti vegetali"
24010102004,1100083,"Eseguire le diverse operazioni di preparazione e sistemazione del terreno e le opere di sistemazione idraulico-forestale, utilizzando in sicurezza gli strumenti e le macchine "
1777,251777,"Riconoscere segnali di malessere o infortunio dell'animale per operare i corretti interventi e segnalarli al supervisore"
24010102004,1100084,"Irrorare i prodotti antiparassitari, diserbanti e fitopatologici, seguendo le procedure ed adottando i dispositivi di protezione individuale previsti dalla normativa di riferimento "
24010102004,1100085,"Utilizzare secondo le prescrizioni le attrezzature specifiche per movimentazione carichi elencate nella normativa "
24010102005,1100086,"Applicare le procedure di gestione ambientale "
24010102005,1100087,"Controllare e valutare la corrispondenza progettuale"
24010102005,1100088,"Individuare i limiti ambientali"
24010102006,1100089,"Riconoscere gli ambienti fisici e il carattere dei luoghi di intervento, manutenzione e ripristino "
24010102006,1100090,"Pulire gli alvei di canali, valloni etc... "
24010102006,1100091,"Garantire il deflusso e lo smaltimento delle acque superficiali "
24010102006,1100092,"Utilizzare i mezzi e gli strumenti secondo le caratteristiche e le necessità "
24010102006,1100093,"Mettere in sicurezza i territori esposti ai rischi naturali con la realizzazione di opere di sistemazione idraulico forestale"
24010102006,1100094,"Garantire la segnalazione delle infrazioni e dei danni rilevati alle autorità preposte"
24010102006,1100095,"Effettuare interventi antierosivi"
24010102006,1100096,"Effettuare interventi stabilizzanti"
24010102007,1100097,"Monitorare la realizzazione degli interventi di tutela, bonifica e ripristino ambientale e valutarne l'efficienza"
24010102007,1100098,"Attuare la realizzazione degli interventi ordinari e straordinari, per la tutela e/o il recupero della componente biotica e abiotica"
24010102007,1100099,"Attuare la tipologia di interventi come conseguenza dello status della componente biotica e abiotica, dei fattori di pressione sulle diverse componenti ambientali e degli impatti attuali/potenziali"
24010102007,1100100,"Collaborare con gli altri servizi di tutela ambientale e con gli uffici ed agenti di polizia per le attività di prevenzione del patrimonio forestale "
24010102007,1100101,"Registrare e comunicare alle autorità competenti gli esiti sui danni all'ambiente nella zona interessata dagli interventi programmati, rispettando le procedure definite dalla normativa di riferimento "
24010102007,1100102,"Partecipare alla definizione di interventi ordinari e straordinari, per la tutela della componente biotica e abiotica, volti alla protezione dei siti e/o al ripristino delle aree degradate "
24010102007,1100103,"Individuare la tipologia di interventi preventivi atti a preservare da danneggiamenti l'area, o interventi tempestivi per il ripristino ambientale in caso didanneggiamenti, anche attraverso il coinvolgimento di altri addetti e tecnici specifici."
876,200876,"Eseguire operazioni di taglio con gli strumenti idonei e in condizioni di sicurezza"
876,150876,"Eseguire le operazioni di legatura, sanificazione, raccolta dei residui sulla base delle esigenze della pianta e delle scelte dell'impresa"
876,100876,"Dare la forma di allevamento prescelta sulla base di considerazioni di carattere produttivo o di sviluppo della pianta"
876,50876,"Collocare le potature nel periodo vegetativo migliore per la pianta per non compromettere la risposta vegetativa prevedendo i tempi necessari e garantendo l'efficienza degli attrezzi"
877,150877,"Impiegare attrezzature specifiche, scale e strumenti per il taglio in condizioni di sicurezza"
877,100877,"Guidare le macchine agricole nelle condizioni caratterizzanti ciascuna tipologia di coltivazione"
877,50877,"Gestire la manutenzione ordinaria di macchine ed attrezzi per il loro migliore utilizzo e per la sicurezza dell'operatore"
1158,151158,"Verificare che gli interventi avvengano in condizioni di sicurezza nel rispetto delle normative in vigore"
1158,101158,"Scegliere il tipo di innesto sulla base dei risultati che si intendono ottenere sul piano produttivo e delle condizioni di sviluppo e fitosanitarie delle piante"
1158,51158,"Individuare il periodo migliore per eseguire gli innesti, tenendo conto delle caratteristiche delle piante e delle reazioni vegetative sia delle piante madri che dei portainnesti"
1091,201091,"Rispettare i vincoli d'impiego per un uso in sicurezza delle motrici"
1091,151091,"Guidare le motrici nelle varie attività aziendali (ad es. lavorazioni, trasporto, trattamenti)"
1091,101091,"Gestire con efficacia le macchine operatrici agganciate alla matrice"
1091,51091,"Effettuare le valutazioni tecnico-operative per la scelta e l'impiego delle macchine operatrici"
1092,251092,"Utilizzare le macchine per la raccolta dei prodotti (es. carri raccolta)"
1092,201092,"Utilizzare le macchine per la movimentazione terra (es. pala meccanica)"
1092,151092,"Utilizzare le macchine operatrici per le lavorazioni del terreno (es. aratri, ripper)"
1092,101092,"Rispettare i vincoli d'impiego per un uso in sicurezza delle operatrici"
1092,51092,"Effettuare efficacemente le operazioni agroforestali e di gestione ambientali"
1093,201093,"Verificare la potenza, l'aderenza e la stabilità del binomio motrice-operatrice"
1093,151093,"Utilizzare il binomio motrice-operatrice senza sforzare oltre misura nessuna delle due macchine"
1093,101093,"Regolare e tarare le varie macchine operatrici con le quali si deve effettuare le operazioni colturali"
1093,51093,"Effettuare un accoppiamento corretto tra motrice e operatrice"
1094,201094,"Valutare i requisiti di sicurezza offerti dalla motrice e dalla macchina operatrice"
1094,151094,"Mantenere le macchine in piena efficienza, verificando che l'impiego sia pienamente conforme alla destinazione prevista"
1094,101094,"Intervenire sulla impostazione del cantiere, con particolare riferimento alla macchina impiegata, per poter elevare e mantenere i livelli di sicurezza del lavoro"
1094,51094,"Effettuare una analisi del cantiere di lavoro per determinare le criticità in relazione alle operazioni previste"
1776,151776,"Condurre il cavallo per lavorare alla corda secondo le indicazioni dell'allenatore supervisore"
1776,101776,"Collaborare con gli esperti preposti alla doma dell'animale"
1776,51776,"Applicare sistemi di attacco per collegare al meglio l'animale a carrozze o altri mezzi di trasporto"
1776,301776,"Sistemare in maniera idonea il cavallo sul mezzo di trasporto per eventuali trasferte"
1776,251776,"Movimentare quotidianamente l'animale per garantire l'allenamento e la forma fisica"
1776,201776,"Effettuare la vestizione del cavallo e curare la manutenzione dei finimenti in relazione all'evento o prestazione fisica prevista"
1777,201777,"Montare con equilibrio, assetto e padronanza dell'animale, nel rispetto delle normative di sicurezza"
1777,151777,"Gestire il cavallo sulle diverse andature e in condizioni di lavoro di gruppo"
1777,101777,"Effettuare le operazioni di riscaldamento e defaticamento dell'animale al fine di garantirne la piena efficienza psicofisica"
1777,51777,"Condurre il cavallo in una partenza con gabbie"
1775,101775,"Approcciarsi adeguatamente al cavallo anche ai fini di una movimentazione dell'animale in condizioni di sicurezza"
1775,51775,"Applicare mansioni di ricovero e metodi di scuderizzazione per garantire all'animale le migliori condizioni psicofisiche"
1775,201775,"Curare e mantenere l'impianto e rimuovere le lettiere per garantire la massima salubrità ed igienicità all'ambiente"
1775,151775,"Assistere e collaborare a tutte le operazioni di routine dell'animale che si ha in cura (ad es. tosatura e ferratura) osservando con attenzione l'aspetto e il comportamento dell'animale e segnalando eventuali anomalie al responsabile"
1775,451775,"Svolgere servizio manuale di scuderia in conformità alle richieste dell'allevatore o allenatore"
1775,401775,"Somministrare gli alimenti secondo le indicazioni del responsabile"
1775,351775,"Riconoscere le principali patologie degli equini e compiere piccoli interventi di pronto soccorso richiesti in condizioni idonee"
1775,301775,"Pulire quotidianamente il corpo dell'animale (cosiddetto "
1775,251775,"Curare la salute del piede del cavallo in conformità alle indicazioni del maniscalco responsabile"
101,150101,"Impostare un programma di lavorazioni di un giardino o di una area verde"
101,100101,"Identificare gli strumenti manuali per le diverse fasi della lavorazione del terreno in aree verdi"
101,50101,"Effettuare le operazioni di rifinitura di un terreno per la stesura di un prato pronto"
101,200101,"Utilizzare gli strumenti di lavoro ed i mezzi meccanici per le diverse fasi della lavorazione del terreno in aree verdi"
106,200106,"Pianificare gli interventi irrigui durante l'anno in relazione anche all'andamento stagionale"
106,150106,"Implementare l'impianto con parti e componenti nuovi per incrementare l'area irrigata o l'efficienza di irrigazione"
106,100106,"Gestire l'utilizzo dell'impianto di irrigazione in modo da minimizzare gli sprechi di acqua"
106,50106,"Controllare l'impianto di irrigazione mantenendolo in piena efficienza anche attraverso piccoli interventi di manutenzione"
106,250106,"Rilevare la necessità di uno specifico intervento irriguo per una qualsiasi area a verde in relazione alle sue caratteristiche"
144,200144,"Utilizzare i prodotti nelle dosi e modalità corrette, evitando fenomeni di sovradosaggio o danni per errori di somministrazione"
144,150144,"Scegliere il momento migliore per un intervento di concimazione sulle piante in coltivazione"
144,100144,"Scegliere i prodotti più adatti in relazione al tipo di piante presenti"
144,50144,"Pianificare la concimazione di un giardino, un'aiuola, un'area verde, di vasi su un terrazzo"
145,200145,"Valutare con attenzione l'impiego di prodotti chimici in particolari ambiti (ad es. nel verde pubblico)"
145,150145,"Scegliere i prodotti antiparassitari più idonei in relazione alla tipologia di sintomi rilevati"
145,100145,"Impostare un programma di difesa del verde con prodotti e tecniche a ridotto impatto ambientale"
145,50145,"Identificare una malattia o un attacco parassitario valutandone l'estensione e la gravità sulle piante"
146,150146,"Effettuare una semplice manutenzione degli strumenti e delle macchine per mantenerle in piena efficienza"
146,100146,"Effettuare le potature delle piante rispettando le forme vegetali presenti senza alterare le condizioni fisiologiche"
146,50146,"Collocare le potature delle piante nei periodi indicati per non compromettere la risposta delle essenze vegetali"
146,250146,"Verificare che l'intervento (potatura, sfalcio) avvenga in condizioni di sicurezza per gli operatori e per le altre persone"
146,200146,"Pianificare gli sfalci del prato per mantenere il cotico erboso ben rasato e compatto"
748,100748,"Effettuare le scelte tecniche aziendali sulla base della realtà produttiva disponibile e nel rispetto dei vincoli normativi in essere"
748,50748,"Controllare la correttezza della contabilità e dell'amministrazione"
748,200748,"Programmare aquisti e manutenzioni di macchine ed attrezzature sulla base di valutazioni economiche e tecniche"
748,150748,"Gestire la contrattualistica aziendale secondo la vigente normativa"
748,250748,"Stabilire gli obiettivi produttivi da raggiungere, gli eventuali investimenti da operare e gli eventuali cambi di indirizzo produttivo sulla base di una strategia aziendale che prenda in considerazione tutti gli aspetti dell'impresa ed i fattori esterni che possono incidere sulla stessa"
751,200751,"Rappresentare l'azienda nelle relazioni esterne ed interne sulla base del ruolo che di volta in volta la figura svolge"
751,150751,"Gestire i rapporti con enti pubblici e privati utili al fine del raggiungimento degli obiettivi d'impresa"
751,100751,"Gestire i rapporti con dipendenti, operai, consulenti nel quadro della contrattualistica e degli obiettivi dell'impresa"
751,50751,"Gestire i rapporti con clienti, fornitori e interlocutori del mercato nel rispetto dei ruoli e nei tempi opportuni"
752,100752,"Definire incarichi, compiti, funzioni, turni di lavoro e periodi di lavoro sulla base delle esigenze dell'impresa e dei apporti contrattuali in essere"
752,50752,"Acquisire innovazioni sui processi produttivi e sulle tecniche e tecnologie da adottare nell'attività d'impresa"
752,150752,"Gestire eventuali contenziosi interni ed esterni all'impresa in modo corretto e proficuo ai fini della attività produttiva"
752,200752,"Scegliere i metodi produttivi da adottare e le conseguenti tecniche di coltivazione sulla base delle caratteristiche dell'impresa e del mercato di riferimento"
