id_competenza,id_abilita,descrizione
1938,251938,"Supportare il gruppo nella ricerca delle risorse necessarie alla realizzazione del progetto"
1938,301938,"Svolgere una funzione di mediazione tra il gruppo ed i vari soggetti pubblici e/o privati al fine di facilitare lo sviluppo di interazioni positive"
1937,51937,"Applicare le tecniche del colloquio di aiuto per guidare l'esposizione dell'utente in modo da raccogliere in maniera esaustiva il quadro dei suoi bisogni"
1937,101937,"Applicare le tecniche della social network analysis per individuare le risorse di rete eventualmente attivabili per facilitare il superamento della situazione di esclusione"
1937,151937,"Applicare le tecniche di bilancio delle competenze, esplicitando le opportunità e le criticità del soggetto e per ricostruire l'insieme delle risorse personali e di rete eventualmente attivabili"
1937,201937,"Condividere con il soggetto ed eventuali altri operatori che intervengono a suo favore gli obiettivi, le soluzioni individuate e le linee operative del progetto di inclusione"
1937,251937,"Individuare le soluzioni più adatte a rispondere ai bisogni individuati con l'utente, formalizzandole in linee e proposizioni di accompagnamento all'interno di un progetto strutturato di intervento"
1937,301937,"Selezionare le informazioni raccolte, individuando fra l'insieme dei bisogni esplicitati quelli a cui è necessario/possibile fornire risposte"
1937,401937,"Supportare l'utente nella ricostruzione autobiografica del percorso di vita, favorendo l'assunzione di un approccio positivo e l'avvio e sviluppo di processi di empowerment e resilienza"
1937,351937,"Sostenere il soggetto nella realizzazione del progetto di autonomia e di partecipazione attraverso un percorso di empowerment personale"
1935,51935,"Analizzare, elaborandoli, le diverse tipologie di dati riguardanti i profili della comunità nella quale si dovrà interventire"
1935,101935,"Elaborare report di sintesi dei dati emersi dall'attività di ricognizione sociale"
1935,151935,"Gestire le relazioni con i servizi pubblici e le risorse del territorio, per la loro attivazione e coinvolgimento nell'attività di ricognizione sociale"
1935,201935,"Impostare e condurre un intervento di ricognizione sociale finalizzato alla progettazione di interventi di inclusione e promozione sociale"
1936,151936,"Impostare modalità e contenuti dei primi contatti con singoli utenti o gruppi"
1936,101936,"Impostare e realizzare le osservazioni sul territorio preliminari al contatto diretto con singoli utenti o gruppi"
1936,51936,"Avviare la relazione di aiuto con il singolo utente o il gruppo"
1936,201936,"Rilevare gli indicatori psico- sociali che caratterizzano l'esclusione o la marginalità del singolo soggetto o del gruppo"
1839,51839,"Compilare il formulario (application form)"
1839,101839,"Effettuare ricerche e valutazioni di opportunità di finanziamento pubblico partendo dalle esigenze del cliente"
25011900802,19100031,"Scegliere e adottare le tecniche comunicative più adeguate ai vari contesti lavorativi"
1839,151839,"Elaborare una idea progettuale e procedere alla stesura e presentazione del progetto, utilizzando specifiche metodologie e rispettando i requisiti formali e di merito (documentazione tecnica) e predisponendo il piano finanziario"
1839,201839,"Individuare ed analizzare i programmi, le linee di finanziamento ed i relativi bandi di gara (calls for tender) e gli inviti a presentare proposte (calls for proposal)"
1839,251839,"Individuare indicatori per la verifica e la valutazione"
1839,301839,"Ricercare partner nazionali e transnazionali per la realizzazione delle attività e definire gli accordi di rete"
1839,351839,"Valutare criticità, rischi e opportunità che influenzano il progetto"
1928,51928,"Comprendere e interpretare le specifiche dei bandi di gara, assicurando una valutazione dettagliata ed approfondita rispetto agli impegni da assumere valutando l'adeguatezza della propria azienda rispetto alle condizioni richieste"
1928,101928,"Definire le coordinate di un intervento di sviluppo locale nel settore socio- sanitario da affrontare mediante la realizzazione del progetto"
1928,151928,"Individuare e coinvolgere soggetti istituzionali o altri stakeholders in forme di sostegno o partneriato"
1928,201928,"Pianificare e coordinare l'intero processo di progettazione, valorizzando il lavoro d'équipe e la suddivisione delle responsabilità con gli eventuali collaboratori"
1928,301928,"Verificare l'iter amministrativo e i termini per l'ammissibilità del progetto, per predisporre una adeguata programmazione del lavoro"
1928,251928,"Selezionare la normativa e la documentazione tecnica collegata ai bandi, garantendo le appropriate scelte in ordine alla tipologia del servizio messo a gara"
1929,51929,"Coinvolgere i soggetti che hanno dichiarato la loro disponibilità a svolgere forme di partenariato e collaborazione al progetto nella definizione di proposte migliorative rispetto ai contenuti indicati nel bando o capitolato"
1929,101929,"Definire le procedure per il reperimento, la raccolta e l'aggiornamento costante delle informazioni, assicurando un flusso informativo efficace"
1929,151929,"Descrivere la tipologia di utenza e i relativi bisogni, se richiesto dal bando, in modo da dimostrare la necessaria conoscenza dettagliata del servizio e delle sue problematiche"
1929,201929,"Identificare la tipologia delle informazioni necessarie alla progettazione compiendo una loro appropriata selezione"
1929,251929,"Intervenire in modo adeguato dal punto di vista emotivo e operativo sulle criticità che si possono presentare durante il lavoro di progettazione, al fine di risolverle"
1929,301929,"Monitorare le fasi di valutazione e aggiudicazione del servizio, verificando che le relative procedure siano svolte nel pieno rispetto delle norme in materia di appalto"
1929,351929,"Organizzare i materiali informativi e gli stock dei dati assicurandone il più appropriato utilizzo funzionale alla progettazione"
1929,451929,"Prediporre tutta la documentazione richiesta nella forma indicata nel bando o capitolato, verificandone la completezza e la conformità, entro il termine definito dalla Stazione appaltante o dall'Ente che ha emesso il bando"
1929,401929,"Pianificare percorsi di formazione/aggiornamento per il personale, in particolare se richiesti dal bando, in modo da offrire adeguati standard di qualificazione sulle risorse umane impiegate"
1929,501929,"Redigere la relazione tecnica garantendo una rappresentazione efficace dell'intervento/servizio sotto il profilo formale e sostanziale, nel rispetto dei requisiti e degli standard predisposti dal capitolato di appalto"
1930,51930,"Individuare i costi delle risorse necessarie"
1930,101930,"Individuare le risorse strumentali e di personale necessarie per l'attuazione del progetto in vista di conseguire risultati di efficienza"
1930,151930,"Supportare il responsabile amministrativo dell'impresa nella redazione del piano finanziario e, quando richiesto, dell'offerta economica della gara di appalto"
1927,101927,"Elaborare report di sintesi dei dati emersi dall'attività di ricognizione sociale"
1927,51927,"Definire l'idea progettuale in modo sintetico, chiaro e rispondente ai bisogni individuati con l'attività di ricognizione sociale"
1927,151927,"Gestire le relazioni con i servizi pubblici e le risorse del territorio, per la loro attivazione e coinvolgimento nell'attività di ricognizione sociale"
1927,201927,"Impostare e realizzare interventi di ricognizione sociale per la lettura del profilo della comunità nella quale si dovrà intervenire"
1927,301927,"Relazionarsi con le reti istituzionali e non istituzionali qualificate per avere informazioni, in modo costante ed in tempo reale, sulla possibilità di finanziamento per i diversi tipi di interventi sociali"
1927,251927,"Individuare e gestire fonti informative qualificate per l'offerta di bandi pubblici e gare, in modo da recepire costantemente e in tempo reale le novità di offerta immesse sul mercato dei servizi"
25021900602,19100146,"Condurre laboratori adottando in situazione tecniche e metodologie"
25021900602,19100147,"Favorire lo sviluppo fisico, il rilassamento, l'attenzione e la concentrazione"
25021900602,19100148,"Applicare tecniche di primo soccorso"
25021900602,19100149,"Utilizzare attrezzature multimediali"
25021900603,19100150,"Applicare tecniche di gestione dei gruppi, valorizzando le risorse individuali e collettive"
25021900603,19100151,"Favorire la partecipazione dei singoli supportando l'interazione con il gruppo"
25021900603,19100152,"Adottare strategie di comunicazione efficaci con l'assistito, la famiglia e gli altri professionisti di riferimento"
25021900603,19100153,"Applicare tecniche di rilevazione dei segnali di disagio"
25021900601,19100141,"Analizzare le condizioni organizzative e strutturali di realizzazione dell’intervento al fine di individuare soluzioni operative adeguate"
24010201401,2100146,"Applicare tecniche di primo soccorso;"
25021900601,19100142,"Comprendere le specifiche esigenze dell’individuo verso cui è indirizzato l’intervento e le condizioni di contesto "
25021900601,19100143,"Interpretare i bisogni individuati in collaborazione con gli altri operatori e ruoli coinvolti, per adattare gli interventi di animazione al target di riferimento"
25021900602,19100144,"Organizzare interventi di animazione e socializzazione all’interno di strutture e sul territorio"
25021900602,19100145,"Organizzare spazi e scegliere materiali e strumenti in base all’attività e all’utenza "
1888,101888,"Lavorare in èquipe multidisciplinare a carattere socio-sanitario, educativo- assistenziale e di rete territoriale"
1888,51888,"Calibrare la comunicazione rispetto all'interlocutore e all'ambito in cui essa avviene"
1888,151888,"Promuovere la conoscenza e lo sviluppo a tutti i livelli della riabilitazione per disabili visivi in Orientamento e Mobilità e Autonomia Personale attraverso la collaborazione con tutte le figure dell'ambito riabilitativo e socio-sanitario"
1888,201888,"Usare gli strumenti di comunicazione e condivisione di informazioni e le risorse messe a disposizione della rete internet"
1887,51887,"Contribuire alla formazione e aggiornamento del personale educativo, assistenziale e sanitario per gli aspetti di OM e AP"
1887,101887,"Partecipare alla scelta e all'ideazione di specifici ausili, tecnologie, strumenti e facilitatori per l' OM e AP"
1887,201887,"Promuovere il recupero e l'uso ottimale di funzioni finalizzate al reinserimento, all'adattamento e all'integrazione dell'individuo nell'ambiente di vita"
1887,151887,"Promuovere azioni educative di OM e AP verso il soggetto in trattamento, la famiglia e la collettività"
1887,251887,"Promuovere l'utilizzo di ausili per l'OM e AP che favoriscano l'inserimento di soggetti con disabilità visiva"
1887,301887,"Proporre modifiche all'ambiente di vita (barriere architettoniche e percettive) per l'OM e AP"
1887,351887,"Valutare fruibilità e accessibilità in riferimento a barriere strutturali, funzionali, percettive proponendo soluzioni integrate"
1885,51885,"Graduare e mantenere una giusta distanza fisica e psicologica per rafforzare la consapevolezza e la competenza dell'utente"
1885,101885,"Individuare ed esaltare gli aspetti motivazionali e le potenzialità di adattamento dell'individuo"
1885,151885,"Realizzare training di OM e AP applicando azioni educative, formative, riabilitative, multifunzionali e cognitive"
1885,201885,"Stabilire con l'utente una relazione specificamente finalizzata alla sua autonomia e indipendenza"
1886,51886,"Esprimere una valutazione delle capacità e delle performance dell'utente in funzione di sicurezza, responsabilità ed autonomia"
1886,101886,"Redigere una relazione rispetto alla valutazione effettuata che sia condivisibile con gli altri operatori della riabilitazione, con la famiglia e con l'utente"
1886,151886,"Verificare le rispondenze tra la metodologia riabilitativa attuata e gli obiettivi di recupero funzionale e psicosociale per l'OM e AP"
1884,51884,"Definire obiettivi di OM e AP, tempi e metodi per raggiungere e consolidare capacità e performance specifici attraverso piani di intervento individuali e individualizzati"
1884,101884,"Interpretare e utilizzare i referti di valutazione correlandoli con i campi sanitari ed educativi"
1884,201884,"Progettare training individuali ed individualizzati di OM e AP"
1884,151884,"Mettere in pratica training individuali ed individualizzati di OM e AP"
1884,251884,"Valutare i prerequisiti di OM e AP dell'utente"
25011900801,19100016,"Svolgere una funzione di mediazione tra l'utente e i vari soggetti pubblici e/o privati al fine di facilitare 'e l'analisi dei bisogni dell'utente"
25011900802,19100032,"Rendere espliciti i riferimenti culturali, religiosi e di genere, nonché i bisogni degli utenti e dei loro interlocutori nella gestione della relazione comunicativa"
25011900802,19100033,"Decodificare i codici comunicativi non espressi in modo da facilitare i meccanismi di comprensione"
25011900802,19100034,"Comprendere linguaggio, espressioni culturali e sociali, comportamenti e significati della comunicazione verbale e non verbale dell'utente con background migratorio"
25011900802,19100035,"Trasferire elementi conoscitivi all'utente, relativamente alla realtà sociale e organizzativa del contesto di riferimento"
25011900803,19100036,"Condividere con il soggetto ed eventuali altri operatori che intervengono a suo favore gli obiettivi, le soluzioni individuate e le linee operative del progetto di inclusione"
25011900803,19100037,"Fornire informazioni utili ai cittadini con background migratorio sul contesto sociale, politico e amministrativo del paese ospitante al fine di facilitare il processo di integrazione"
25011900803,19100038,"Supportare la progettazione di interventi migliorativi dei servizi, in funzione delle necessità specifiche espresse dall'utenza, avendo anche cura dello sviluppo professionale degli operatori junior"
25011900803,19100039,"Relazionarsi con le reti istituzionali qualificate per avere informazioni aggiornate, in modo costante e in tempo reale, sulla possibilità di attivazione dei diversi tipi di intervento sociale"
25011900803,19100040,"Facilitare occasioni di incontro e scambio tra culture e sistemi valoriali diversi che promuovano l'educazione interculturale nella comunità locale e contrastino fenomeni di discriminazione ed emarginazione"
25011900803,19100041,"Collaborare con i professionisti di settore per l'indagine e l'analisi dei bisogni individuali, assicurandosi che l'utente e gli operatori siano in grado di interpretare in maniera corretta i rispettivi schemi comunicativi"
25011900803,19100042,"Supportare gli operatori dei servizi nelle attività di mentoring, tutoraggio dei processi di inserimento"
25011900803,19100043,"Collaborare con i professionisti per la pianificazione dei percorsi personalizzati di inserimento sociale, interpretando i codici culturali per facilitare la comunicazione delle parti coinvolte nella relazione"
25011900901,19100044,"Analizzare le condizioni organizzative e contestuali dell'intervento"
25011900901,19100045,"Condividere e verificare il risultato dell'analisi con le altre figure professionali che partecipano al progetto educativo individualizzato"
25011900901,19100046,"Individuare e analizzare i bisogni di autonomia, comunicazione e inclusione nonché le risorse personali e della rete sociale del soggetto a favore del quale si dovranno organizzare appropriati interventi"
25011900901,19100047,"Promuovere e valorizzare la partecipazione del soggetto e di altri stakeholders nell'analisi dei bisogni e delle risorse personali e contestuali."
25011900902,19100048,"Condividere con il soggetto con cui si opera ed altri stakeholders interessati gli obiettivi e le attività del piano personalizzato"
25011900902,19100049,"Partecipare alle verifiche periodiche del PEI e agli incontri del GLHO"
25011900902,19100050,"Definire obiettivi, metodologie e attività di assistenza all'autonomia e alla comunicazione con specifica attenzione all'acquisizione delle autonomie e alla socializzazione in contesti di apprendimento coerenti al Progetto Educativo Individualizzato"
25011900902,19100051,"Identificare modalità d' informazione e scambio comunicativo tra il contesto scolastico e la famiglia"
25011900902,19100052,"Valutare la fattibilità degli interventi di assistenza sulla base delle condizioni strutturali del contesto scolastico e/o sociale, adottando le modalità più appropriate di partecipazione alle diverse attività scolastiche ricreative e formative"
25011900903,19100053,"Condividere la valutazione dei risultati dell'intervento con le figure dell'Equipe Multidisciplinare"
25011900903,19100054,"Documentare le attività realizzate mediante l'utilizzo di tutti gli strumenti tecnologici disponibili"
25011900903,19100055,"Osservare, con sistematicità, la partecipazione del soggetto all'attività, cogliendo gli elementi informativi utili al processo di valutazione"
25011900903,19100056,"Riadattare il piano personalizzato e/o modificare le attività in base ai risultati della valutazione"
25011900903,19100057,"Riflettere criticamente sul proprio operato professionale, valorizzando il confronto con colleghi e le altre figure, per promuovere le migliori pratiche professionali"
25011900903,19100058,"Valutare i risultati raggiunti in termini di coerenza rispetto agli obiettivi definiti nel piano personalizzato"
25011900904,19100059,"Applicare le diverse tecniche per lo sviluppo dell'autonomia personale, per la costruzione dell'autosufficienza nel vivere e nel fare quotidiano delle funzioni primarie"
25011900904,19100060,"Facilitare la comunicazione, attraverso l'impiego delle diverse tecniche aumentative e alternative, per lo sviluppo dell'auto-efficacia e della crescita delle potenzialità individuali"
25011900904,19100061,"Promuovere e valorizzare la partecipazione del soggetto e di altri stakeholders nella realizzazione delle attività di sostegno"
25011900904,19100062,"Utilizzare strumenti didattici di supporto, quali materiali didattici speciali e attrezzature idonee per specifiche disabilità, al fine di sollecitare i diversi canali di apprendimento"
25011900904,19100063,"Scegliere e adattare materiali didattici e attività in modo funzionale alle condizioni del soggetto e del contesto di intervento"
25011900905,19100064,"Riconoscere e adottare le modalità più appropriate di partecipazione del soggetto alle diverse attività scolastiche, ricreative e formative al fine di raggiungere gli obiettivi didattici ed educativi programmati"
25011900905,19100065,"Coinvolgere i membri dei gruppi sociali cui partecipa al fine di favorire lo sviluppo di dinamiche inclusive"
25011900905,19100066,"Favorire la partecipazione attiva alle attività del gruppo classe o dei pari"
25011900905,19100067,"Impostare e gestire la relazione di sostegno con il soggetto nel rispetto dei principi deontologici"
25011900905,19100068,"Osservare e analizzare le dinamiche dei gruppi sociali a cui partecipa il soggetto"
25011900905,19100069,"Riconoscere e gestire positivamente le emozioni, i linguaggi e i bisogni che si sviluppano nella relazione"
24010201201,2100031,"Monitorare le fasi di trasformazione effettuando eventuali interventi correttivi"
24010201201,2100032," Applicare la normativa sulla sicurezza utilizzando gli opportuni DPI"
24010201201,2100033," Predisporre gli spazi di lavoro, i macchinari e i materiali per il processo di confezionamento"
24010201201,2100034," Determinare i tempi necessari per le diverse tipologie di lavorazione"
24010201201,2100035," Stabilire la modalità di confezionamento più adatta al tipo di prodotto e alla finalità"
24010201201,2100036," Utilizzare la tecnica di confezionamento più idonea: aggraffatura, imbottigliamento, pastorizzazione, sterilizzazione, etichettatura, pallettizzazione, cellophanatura"
24010201201,2100037," Eseguire l'etichettatura dei prodotti alimentari"
24010201201,2100038," Adottare modalità di identificazione e codificazione automatica dei prodotti alimentari"
24010201201,2100039," Applicare tecniche di confezionamento specifiche per l'esposizione e la vendita diretta al cliente"
24010201202,2100040,"Applicare la normativa sulla sicurezza utilizzando gli opportuni DPI"
24010201202,2100041," Pulire e igienizzare spazi e attrezzature"
24010201202,2100042," Monitorare le fasi di trasformazione effettuando eventuali interventi correttivi"
24010201202,2100034," Determinare i tempi necessari per le diverse tipologie di lavorazione"
24010201202,2100044," Controllare il latte in arrivo e procedere alla filtrazione"
24010201202,2100045," Effettuare i trattamenti termici al latte"
24010201202,2100046," Controllare l'efficacia dei trattamenti termici al latte"
24010201202,2100047," Effettuare l'omogeneizzazione del latte"
24010201202,2100048," Realizzare la scrematura, per affioramento e per centrifugazione"
24010201202,2100049," Predisporre la linea di lavoro per le diverse lavorazioni previste dal piano di produzione"
24010201203,2100050,"Allestire il banco espositivo delle carni"
24010201203,2100051," Applicare procedure di conservazione delle carni"
24010201203,2100041," Pulire e igienizzare spazi e attrezzature"
24010201203,2100032," Applicare la normativa sulla sicurezza utilizzando gli opportuni DPI"
24010201203,2100054," Applicare metodologie produttive finalizzate a valorizzare prodotti tipici del territorio"
24010201203,2100055," Tritare la carne (es. macinato, hamburgher)"
24010201203,2100056," Realizzare prodotti pronto-cuoci"
24010201203,2100042," Monitorare le fasi di trasformazione effettuando eventuali interventi correttivi"
24010201203,2100034," Determinare i tempi necessari per le diverse tipologie di lavorazione"
24010201203,2100059," Controllare le carni in arrivo dai macelli e predisporle alle successive lavorazioni"
24010201203,2100060," Disossare le diverse tipologie di carni"
24010201203,2100061," Realizzare i tagli commerciali della carne mediante strumenti manuali o macchinari (es. fettine, braciole, bistecche, rollata, spezzatino)"
24010201203,2100049," Predisporre la linea di lavoro per le diverse lavorazioni previste dal piano di produzione"
24010201204,2100063,"Applicare metodologie produttive finalizzate a valorizzare prodotti tipici del territorio"
24010201204,2100064," Adottare adeguate modalità di conservazione e stoccaggio degli insaccati"
24010201204,2100065," Controllare i parametri ambientali e tecnologici intervenendo su eventuali anomalie"
24010201204,2100066," Effettuare eventuali interventi di manutenzione ordinaria delle attrezzature"
24010201204,2100034," Determinare i tempi necessari per le diverse tipologie di lavorazione"
24010201204,2100068," Produrre l'impasto di carne e miscelarlo con prodotti aromatizzanti"
24010201204,2100069," Racchiudere l'impasto in involucri (budelli) per produrre diverse tipologie di insaccati"
24010201204,2100042," Monitorare le fasi di trasformazione effettuando eventuali interventi correttivi"
24010201204,2100032," Applicare la normativa sulla sicurezza utilizzando gli opportuni DPI"
24010201204,2100072," Realizzare la maturazione degli insaccati (stagionatura ed affumicatura)"
24010201204,2100073," Controllare l'idoneità delle carni destinate a insaccati"
24010201204,2100074," Predisporre il layout di laboratorio verificando la funzionalità di attrezzi e strumenti"
24010201205,2100075,"Effettuare i trattamenti per la conservazione"
24010201205,2100076," Realizzare la pastorizzazione dei trasformati"
24010201205,2100077," Eseguire l'etichettatura"
24010201205,2100078," Adottare modalità di conservazione e stoccaggio del prodotto finito in dipendenza delle sue caratteristiche"
24010201205,2100079," Operare nel rispetto della normativa sulla sicurezza utilizzando gli opportuni DPI"
24010201205,2100054," Applicare metodologie produttive finalizzate a valorizzare prodotti tipici del territorio"
24010201205,2100034," Determinare i tempi necessari per le diverse tipologie di lavorazione"
24010201205,2100082," Predisporre le materie prime alla lavorazione"
24010201205,2100083," Selezionare attrezzi e strumenti idonei alle specifiche lavorazioni previste, verificandone la funzionalità ed effettuando eventuali interventi di manutenzione ordinaria"
24010201205,2100042," Monitorare le fasi di trasformazione effettuando eventuali interventi correttivi"
24010201205,2100085," Realizzare conservati a base di ortaggi"
24010201205,2100086," Realizzare conservati a base di frutta"
24010201205,2100087," Applicare tecniche di valutazione della qualità e dello stato di maturazione delle materie prime"
24010201206,2100040,"Applicare la normativa sulla sicurezza utilizzando gli opportuni DPI"
24010201206,2100089," Applicare metodologie produttive finalizzate a valorizzare prodotti tipici del territorio (es. ricotta)"
24010201206,2100041," Pulire e igienizzare spazi e attrezzature"
24010201206,2100091," Adottare adeguate modalità di conservazione e stoccaggio dei prodotti finiti"
24010201206,2100092," Tarare e utilizzare l'affumicatore"
24010201206,2100042," Monitorare le fasi di trasformazione effettuando eventuali interventi correttivi"
24010201206,2100094," Produrre la ricotta, anche affumicata"
24010201206,2100095," Produrre yogurt compatto, omogeneo e aromatizzato"
24010201206,2100096," Produrre la panna"
24010201206,2100097," Utilizzare la zangola"
24010201206,2100098," Produrre il burro"
24010201206,2100099," Produrre burro a ridotto tenore di colesterolo"
24010201206,2100034," Determinare i tempi necessari per le diverse tipologie di lavorazione"
24010201206,2100101," Utilizzare e regolare il fermentatore/maturatore"
24010201206,2100102," Effettuare la regolazione della caldaia polivalente per la pastorizzazione"
24010201206,2100103," Utilizzare e regolare il separatore centrifugo"
