id_competenza,id_abilita,descrizione
1345,151345,"Individuare i potenziali clienti e la loro dislocazione territoriale e relazionale per formulare un piano d'azione coerente con il piano di vendita"
1345,101345,"Definire gli obiettivi di vendita e trasformarli in obiettivi di attività pianificate nel tempo in modo da conferire continuità all'azione di esplorazione del mercato per la ricerca di nuovi clienti"
1345,51345,"Analizzare il territorio di lavoro e le sue opportunità per determinare il potenziale e gli obiettivi di vendita"
1346,201346,"Preparare le visite, le interviste e i colloqui di vendita con i clienti sviluppando un obiettivo ed un piano d'azione specifici per ogni appuntamento"
1346,151346,"Organizzare il reporting ed elaborare un sistema di indici per la verifica di efficacia della propria attività di contatto e di vendita con i clienti"
1346,101346,"Gestire il proprio tempo per obiettivi e priorità secondo il programma di visite ed il calendario di appuntamenti fissato"
1346,51346,"Attuare un programma di contatti scritti e telefonici finalizzato agli appuntamenti di prima visita con nuovi clienti o per nuove proposte a già clienti"
1344,201344,"Valutare le varie categorie di rischio connesse con l'attività di investimento nei mercati finanziari utilizzando metodi di calcolo ed indicatori di volatilità adeguati agli strumenti finanziari analizzati"
1344,151344,"Utilizzare gli indicatori e i metodi di analisi tecnica per valutare e spiegare le opportunità di investimento legate alla dinamica dei mercati finanziari"
1344,101344,"Utilizzare gli indicatori e i metodi dell'analisi di bilancio e del metodo empirico (moltiplicatori di borsa) per valutare le caratteristiche fondamentali delle opportunità di investimento su singoli strumenti finanziari o le fasi dei mercati"
1344,51344,"Comprendere i fatti economici negli aspetti congiunturali e settoriali evidenziando la relazione tra il ciclo economico, le prospettive e le opportunità di investimento per i risparmiatori"
1275,151275,"Revisionare i testi di polizza e suggerire modifiche, integrazioni o soluzioni, per eliminare zone di ambiguità od interpretazione indecidibile, rendendo esplicito il contenuto del rischio contrattualmente trasferito ed assunto dall'assicuratore"
1275,101275,"Individuare errori di applicazione dei sistemi di tariffazione o il superamento delle condizioni di autonomia concesse negoziando le necessarie modifiche ed integrazioni contrattuali"
1275,51275,"Formare i corrispondenti all'uso dei sistemi di tariffazione standard, evidenziando il contenuto generale delle politiche assuntive dell'impresa mandante, al fine di diminuire gli errori assuntivi in autonomia"
1274,151274,"Individuare i limiti di esposizione sulla base delle capacità di ritenzione della compagnia, indicando la necessità di ricorso a tecniche di coassicurazione o riassicurazione ed adottando i testi contrattuali e le procedure di emissione delle polizze conseguenti"
1274,101274,"Descrivere le caratteristiche rilevanti del rischio, utilizzando le clausole opportune di carattere generale e particolare per elaborare il testo contrattuale secondo standards di riferimento in uso sul mercato e nell'impresa assicuratrice"
1274,51274,"Analizzare il testo scritto evidenziandone possibili zone di ambiguità o di interpretazione indecidibile al fine di rendere univoco ed esplicito il contenuto di rischio trasferito contrattualmente ed assunto in proprio dall'assicuratore"
1272,151272,"Valutare soggettivamente le caratteristiche migliorative o peggiorative del rischio, rispetto ad analoghi di settore, e proporne la valorizzazione tariffaria"
1272,101272,"Utilizzare i sistemi di tariffazione, manuali o informatici, in uso nell'impresa adattandoli alle caratteristiche specifiche del rischio esaminato"
1272,51272,"Negoziare i provvedimenti di riduzione del rischio, mediante interventi tecnici od organizzativi di protezione o prevenzione influenti sulla tariffazione praticata con i clienti, i superiori o i collaboratori, al fine di condividere ed affinare le valutazioni tariffarie"
1271,301271,"Valutare l'adeguatezza delle misure tecniche ed organizzative predisposte per la sicurezza, la prevenzione dei danni ed il loro contenimento e di individuare i miglioramenti tecnici ed organizzativi ulteriori adottabili"
24011402402,14100041," Monitorare i rischi"
1271,251271,"Realizzare interviste con i responsabili tecnici di produzione, di manutenzione e della sicurezza aziendale, al fine di approfondire le caratteristiche tecniche rilevanti degli impianti e dei processi e di analizzare le misure di prevenzione adottabili"
1271,201271,"Individuare la concentrazione di valore dei beni assicurabili, stimare il grado massimo di danno probabile e la massima unità di rischio, al fine di fornire elementi di stima per la massima perdita potenzialmente inerente il rischio esaminato"
1271,151271,"Individuare i principali potenziali pericoli, quali cause di danno, presenti nel rischio evidenziando i dati essenziali per la decisione assuntiva enucleando i possibili eventi fonte di danno"
1271,101271,"Individuare e descrivere le caratteristiche costruttive rilevanti dei fabbricati visitati nonchè degli impianti e delle attrezzature adottate, al fine di evidenziare gli elementi strutturali caratterizzanti il rischio in esame"
1271,51271,"Analizzare planimetrie di stabilimento, lay out dei macchinari e dei processi per acquisire gli elementi indispensabili alla sua descrizione tecnica"
1414,301414,"Verificare i risultati dell'attività di un gruppo di collaboratori, informandoli sulla qualità del loro lavoro esaminando eventuali scostamenti dai risultati attesi per individuare cause e soluzioni"
1414,251414,"Valutare le esigenze di formazione ed aggiornamento professionale dei collaboratori al fine di promuoverne lo sviluppo formulando un piano di formazione adeguato alle necessità loro e dell'attività della struttura"
1414,201414,"Pianificare il processo di lavoro e attribuire l'impiego delle risorse alle varie attività onde ottenere l'ottimizzazione del tempo-lavoro e delle competenze rispetto agli obiettivi assegnati alla struttura coordinata"
1414,151414,"Individuare le necessità di formazione tecnico matematica specifica degli addetti all'ufficio o del gruppo, non specialisti, progettare e realizzare i relativi interventi"
1414,101414,"Determinare il numero e il profilo professionale degli addetti necessari all'ufficio per elaborare il piano risorse e i programmi di formazione, curando l'inserimento lavorativo dei nuovi collaboratori assegnati"
1414,51414,"Coordinare un gruppo di lavoro o di progetto verificando il rispetto dei tempi assegnati alle varie fasi e la qualità dei risultati intermedi di attività"
1411,251411,"Monitorare e stimare a intervalli periodici la congruità e l'andamento dei premi fornendo supporto metodologico e di calcolo alla formazione periodica dei bilanci tecnici di ramo"
1411,201411,"Gestire le rilevazioni sul Portafoglio Vita e Danni tali da determinare tutti i dati statistici, relativi ai rischi assicurati ed ai sinistri, presi a riferimento per la costruzione tariffaria (determinazione delle basi tecniche)"
1411,151411,"Elaborare le metodologie per il calcolo dei premi assicurativi, tenendo conto della base tecnica disponibile, dei vincoli relativi ai caricamenti massimi applicabili ed al capitale di rischio aziendale"
1411,101411,"Collaborare alla redazione dei documenti illustrativi del processo attuariale di formazione ed adozione delle tariffe commerciali in uso e della loro congruità rispetto ai parametri di riferimento adottati per il calcolo"
1411,51411,"Analizzare prodotti assicurativi concorrenziali per la determinazione del posizionamento commerciale dei prodotti aziendali analoghi, fornendo elementi per la loro modifica o riprogettazione"
1412,351412,"Supportare la gestione operativa di sistemi informatici per l'offerta di servizi finanziari, assicurativi e previdenziali, per la definizione dei metodi di calcolo e l'adeguatezza del trattamento dei dati nelle operazioni di simulazione e comparazione sviluppate"
1412,301412,"Supportare la gestione delle procedure di controllo e di validazione dei dati relativi ai portafogli di rischi per assicurarne la stabilità attesa"
1412,251412,"Supportare l'analisi dei rischi di impresa e dei rischi finanziari connessi con l'esercizio delle attività assicurative e previdenziali per fornire elementi di supporto alle funzioni aziendali responsabili delle attività di pianificazione strategica e di bilancio"
1412,201412,"Elaborare le valutazioni e definirne le metodologie standard per il confronto tra polizze assicurative - nonché tra fondi pensione, prodotti finanziari e altre forme di risparmio gestito - finalizzate a permettere una scelta consapevole da parte dell'utente"
1412,151412,"Concorrere mediante l'uso di metodi quantitativi di tipo matematico e statistico, all'analisi di mercato effettivo e potenziale dell'azienda contribuendo all'esame del posizionamento per la formazione di politiche di marketing o di prodotto"
1412,101412,"Concorrere mediante l'uso di metodi quantitativi di tipo matematico e statistico alla definizione del piano di settore dell'azienda"
1412,51412,"Analizzare la composizione dei portafogli in gestione per stimare le fluttuazioni di rischio imprevedibili e le necessità di riassicurazione o di adeguamento del capitale aziendale al fine di ridurre e minimizzare il rischio di rovina"
1413,251413,"Valutare l'adeguatezza delle modalità della copertura delle riserve tecniche nel rispetto delle norme dispositive in materia"
1413,201413,"Operare il calcolo delle riserve tecniche e del margine di solvibilità necessario alla individuazione dei dati indispensabili per il bilancio e la relazione"
1413,151413,"Elaborare le metodologie per il calcolo delle riserve tecniche nel rispetto delle norme che ne stabiliscono i criteri di formazione e di adeguatezza"
1413,101413,"Contribuire alla valutazione delle poste di bilancio suscettibili di stima attuariale fornendo il supporto metodologico e di calcolo necessari"
1413,51413,"Contribuire alla valutazione del valore del portafoglio dell'impresa, fornendo il supporto metodologico e sviluppando le attività di calcolo necessarie"
1361,151361,"Supportare il cliente nella lettura delle disposizioni contrattuali e nella loro interpretazione per favorire la formazione di aspettative adeguate rispetto alla liquidazione del danno"
1361,101361,"Informare il cliente sull'iter della procedura di liquidazione e sulle possibili esigenze di natura legale e peritale per fornirgli materiale di orientamento utile nelle scelte e attività in vista della liquidazione sinistri"
1361,51361,"Assistere il cliente nella compilazione della modulistica necessaria alla denuncia di sinistro e alla eventuale richiesta a terzi di risarcimento del danno indicandogli i tempi e i passaggi procedurali prevedibili"
1360,151360,"Valorizzare l'attività di incasso per le operazioni di riforma, verifica e correzione del programma assicurativo, al fine di mantenere l'adeguatezza delle soluzioni adottate"
1360,101360,"Utilizzare il cross-selling per espandere la relazione con il cliente fornendogli soluzioni adeguate ai suoi bisogni assicurativi emergenti"
1360,51360,"Affrontare le fasi critiche del rapporto, con l'ascolto, la verifica delle intenzioni e l'illustrazione di nuove opportunità, finalizzati al mantenimento dell'adeguatezza delle soluzioni iniziali adottate per rispondere ai bisogni ed agli obiettivi del cliente"
1359,251359,"Redigere la proposta assicurativa utilizzando l'insieme di strumenti assicurativi adeguati al profilo del cliente ed alle sue necessità di protezione e previdenza evidenziati nella fase di intervista"
1359,201359,"Pianificare l'evoluzione della posizione assicurativa nel tempo per adeguare i contenuti di protezione necessari alle varie fasi di vita del cliente"
1359,151359,"Illustrare la proposta assicurativa formulata in relazione ai bisogni individuati ed espressi dal cliente al fine di ottenerne il consenso alla conclusione contrattuale"
1359,101359,"Esaminare le obiezioni del cliente, valutandone le implicazioni e discutendone i contenuti al fine di ottenerne il consenso alla proposta assicurativa formulatagli o le indicazioni necessarie a modificarla"
1359,51359,"Concludere il contratto raccogliendo il consenso del cliente, la modulistica e le sottoscrizioni necessarie alla sua attivazione"
1356,201356,"Valorizzare le proprie relazioni personali e le potenzialità attrattive del marchio aziendale per realizzare gli obbiettivi del proprio piano di vendita"
1356,151356,"Individuare i potenziali clienti e la loro dislocazione territoriale e relazionale per formulare un piano d'azione coerente con il piano di vendita"
1356,101356,"Definire gli obiettivi di vendita e trasformarli in obiettivi di attività pianificate nel tempo in modo da conferire continuità all'azione di esplorazione del mercato per la ricerca di nuovi clienti"
1356,51356,"Analizzare il territorio di lavoro e le sue opportunità per determinare il potenziale e gli obiettivi di vendita"
1357,201357,"Preparare le visite interviste e i colloqui di vendita con i clienti sviluppando un obiettivo ed un piano d'azione specifici per ogni appuntamento"
1357,151357,"Organizzare il reporting ed elaborare un sistema di indici per la verifica di efficacia della propria attività di contatto e di vendita con i clienti"
1357,101357,"Gestire il proprio tempo per obiettivi e priorità secondo il programma di visite ed il calendario di appuntamenti fissato"
1357,51357,"Attuare un programma di contatti scritti e telefonici finalizzato agli appuntamenti di prima visita con nuovi clienti o per nuove proposte a già clienti"
1358,301358,"Stabilire una relazione empatica con il cliente al fine di ottenere la sua partecipazione effettiva all'intervista"
1358,251358,"Individuare gli obiettivi di protezione e di risparmio finalizzato del cliente al fine di poter elaborare un programma assicurativo coerente con questi obiettivi"
1358,201358,"Illustrare le caratteristiche generali dei servizi assicurativi adeguati alle esigenze del cliente, consegnandogli i materiali di informativa preliminare"
1358,151358,"Determinare l'intervallo temporale del risparmio assicurativo per individuare gli strumenti di copertura adeguati"
1358,101358,"Determinare il profilo di rischio del cliente per selezionare gli strumenti adeguati di copertura dei bisogni di risparmio assicurativo"
1358,51358,"Analizzare la posizione economico patrimoniale del cliente e della sua esposizione ai rischi accidentali per individuare i suoi bisogni assicurativi di protezione personale"
1355,301355,"Utilizzare i contenuti e le notizie della stampa economica relative al sistema di protezione sociale (sanità, pensioni, assicurazioni sociali, istruzione, etc.) per il proprio aggiornamento personale in vista della comprensione e analisi dei bisogni dei propri clienti"
1355,251355,"Individuare le varie categorie di rischio connesse con l'attività di investimento nei mercati finanziari al fine di valutare la volatilità dei prodotti di risparmio assicurativo disponibili, in relazione ai rischi delle soluzioni finanziarie"
1355,201355,"Individuare i rischi principali connessi alla vita privata per la protezione del patrimonio, della persona, per le esigenze fondamentali di previdenza e risparmio finalizzato nel ciclo di vita del cliente"
1355,151355,"Individuare i rischi principali connessi alla vita lavorativa, nello svolgimento di una professione, un'attività commerciale o artigianale per la protezione del patrimonio e della persona, per analizzare i bisogni dei clienti e formulare progetti di copertura assicurativa adeguati"
1355,101355,"Comprendere il ruolo della diversificazione nella protezione dal rischio nelle attività finanziarie al fine di realizzare proposte di risparmio assicurativo e previdenziale adeguate ai bisogni del cliente"
1355,51355,"Comprendere i fatti economici negli aspetti congiunturali e settoriali evidenziando la relazione tra il ciclo economico le prospettive e opportunità di investimento per i risparmiatori in relazione con i prodotti di risparmio assicurativo"
1381,401381,"Utilizzare le procedure operative di attivazione dei servizi di assistenza e tutela legale quando le condizioni della gestione dei sinistri aziendali lo rendano necessario per il cliente"
1381,351381,"Supportare il cliente nella lettura delle disposizioni contrattuali e nella loro interpretazione in modo da facilitare la scelta delle soluzioni assicurative adottate favorendo la formazione di aspettative coerenti con il sistema dei rischi effettivamente trasferito all'assicuratore"
1381,301381,"Realizzare un programma di visite periodiche per le operazioni di verifica e correzione del programma assicurativo in atto tendente a rilevare le modifiche eventualmente intervenute nella mappa dei rischi aziendali ed a predisporre le soluzioni adeguate ai cambiamenti intercorsi"
1381,251381,"Interfacciare il cliente e gli uffici addetti alle attività di perizia e liquidazione del danno agevolando i processi di comunicazione e favorendo la predisposizione degli elaborati, delle stime e della documentazione necessaria alla liquidazione del danno nei tempi previsti"
1381,201381,"Informare il cliente sull'iter della procedura di liquidazione e sulle possibili esigenze di natura legale e peritale individuando l'arco temporale e gli esiti liquidativi prevedibili"
1381,151381,"Implementare un programma concordato di miglioramento nel tempo del sistema delle prestazioni iniziali previste, compatibile con i flussi di spesa definiti per la copertura della mappa dei rischi secondo le priorità aziendali esplicitate"
1381,101381,"Assistere il cliente nella compilazione della modulistica necessaria alla denuncia di sinistro e alla eventuale richiesta a terzi di risarcimento del danno, indicandogli i tempi e i passaggi procedurali prevedibili"
24011402402,14100042," Gestire la comunicazione interna"
24011402403,14100043,"Analizzare lo scenario e le priorità di business"
1381,51381,"Analizzare periodicamente i dati sulla casistica sinistri con il bilancio tecnico delle coperture assicurative adottate, e con l'adozione di un sistema di indicatori di efficacia al fine di mantenere nel tempo l'adeguatezza delle soluzioni prescelte"
1380,301380,"Individuare il ruolo di programmi di previdenza integrativa, nell'ambito delle politiche retributive e di protezione delle risorse umane costituenti la strategia aziendale, per elaborare il piano dei benefits previdenziali"
1380,251380,"Individuare il ruolo di programmi di assistenza integrativa, nell'ambito delle politiche retributive e di protezione delle risorse umane costituenti la strategia aziendale, per elaborare il piano dei benefits assistenziali"
1380,201380,"Individuare gli uomini chiave in azienda e redigere un programma di coperture per i rischi personali, al fine di salvaguardare loro e l'azienda dal danno economico che potrebbe derivarle dal verificarsi di tali rischi"
1380,151380,"Implementare il programma di benefit assistendo il cliente nei vari passaggi informativi e documentali necessari al fine di diffonderne la conoscenza tra i beneficiari addestrandoli all'uso delle prestazioni previste"
1380,101380,"Illustrare la proposta di regolamento aziendale in relazione ai vantaggi previsti per i vari gruppi di soggetti coinvolti, coinvolgendo l'Azienda nel progetto elaborato in relazione alle sue politiche e strategie di sviluppo delle risorse umane"
1380,51380,"Analizzare i benefici fiscali e contributivi derivanti dall'adesione a Casse di Assistenza integrativa quantificandone gli effetti per l'impresa e per i suoi collaboratori beneficiari"
1376,201376,"Valorizzare le proprie relazioni personali e le potenzialità attrattive del marchio aziendale per realizzare gli obiettivi del proprio piano di vendita"
1376,151376,"Individuare i potenziali clienti e la loro dislocazione territoriale e relazionale per formulare un piano d'azione coerente con il piano di vendita"
1376,101376,"Definire gli obiettivi di vendita e trasformarli in obiettivi di attività pianificate nel tempo in modo da conferire continuità all'azione di esplorazione del mercato per la ricerca di nuovi clienti"
1376,51376,"Analizzare il territorio di lavoro e le sue opportunità per determinare il potenziale e gli obiettivi di vendita"
1377,201377,"Preparare le visite, le interviste e i colloqui di vendita con i clienti sviluppando un obiettivo ed un piano d'azione specifici per ogni appuntamento"
1377,151377,"Organizzare il reporting ed elaborare un sistema di indici per la verifica di efficacia della propria attività di contatto e di vendita con i clienti"
1377,101377,"Gestire il proprio tempo per obiettivi e priorità secondo il programma di visite ed il calendario di appuntamenti fissato"
1377,51377,"Attuare un programma di contatti scritti e telefonici finalizzato agli appuntamenti di prima visita con nuovi clienti o per nuove proposte a già clienti"
1378,301378,"Stabilire una relazione empatica con il cliente o i suoi delegati in modo da ottenerne la partecipazione all'attività di analisi e di mappatura dei rischi aziendali"
1378,251378,"Raccogliere notizie sulla casistica sinistri nel tempo, sulla loro tipologia, frequenza e grado di danno per studiarne gli andamenti e la dinamica, valutando il loro impatto economico, la loro trasferibilità assicurativa, i miglioramenti conseguibili con variazioni organizzative o con provvedimenti di trasferimento legale dei rischi"
1378,201378,"Raccogliere notizie sui sistemi di sicurezza e prevenzione adottati, documentandone le caratteristiche, per valutare il loro impatto sulla mappa dei rischi aziendali individuando i possibili interventi di miglioramento implementabili"
1378,151378,"Raccogliere la documentazione necessaria alla valutazione della posizione assicurativa in corso per la formazione del giudizio di adeguatezza e la definizione del programma di cambiamenti da realizzare"
1378,101378,"Raccogliere la documentazione di supporto necessaria all'analisi, alla quantificazione e valutazione dei rischi individuati per la formazione del programma degli interventi prioritari, tecnici, organizzativi e di trasferimento, da realizzare"
1378,51378,"Raccogliere i dati analitici fondamentali per la descrizione della realtà aziendale, della sua struttura organizzativa e funzionale, dei suoi processi produttivi, logistici e commerciali per la stesura della relazione sulla mappa dei rischi aziendali"
1379,451379,"Verificare il consenso del cliente e concludere i contratti raccogliendo la modulistica e le sottoscrizioni necessarie"
1379,401379,"Valutare le obiezioni del cliente discutendone le implicazioni al fine di aumentarne la consapevolezza e partecipazione al processo di scelta e definizione dei contenuti della proposta assicurativa, favorendone il consenso in modo fortemente responsabilizzato"
1379,351379,"Valutare la possibilità e la convenienza del ricorso a forme di autoassicurazione passiva o attiva quando il trasferimento assicurativo si presenti inutile, troppo oneroso o di difficile realizzazione"
1379,301379,"Valutare la possibilità e convenienza di interventi di trattamento tecnico del rischio a fini di prevenzione o controllo del grado di danno"
1379,251379,"Valutare la possibilità di utilizzo di schemi di copertura alternativi mediante l'analisi costi benefici al fine di consentire al cliente di scegliere tra soluzioni con differente grado di complessità ed adeguatezza"
1379,201379,"Valutare la possibilità di ricorso a tecniche di trasferimento del rischio di tipo legale o organizzativo ove queste presentino convenienza in termini di riduzione di frequenza del danno atteso o del suo impatto economico"
1379,151379,"Pianificare l'evoluzione della posizione assicurativa nel tempo compatibile con i flussi di spesa pianificati ed il piano di priorità degli interventi individuato"
1379,101379,"Individuare l'insieme di strumenti assicurativi adeguati alla mappatura dei rischi aziendali effettuata ed alle priorità individuate"
1379,51379,"Illustrare la proposta assicurativa in relazione ai vantaggi quantificabili in termini di economie gestionali o miglioramento di standard di sicurezza e copertura in caso di danno, coerentemente con il documento di mappatura dei rischi aziendali e le priorità individuate"
1375,201375,"Reperire il testo delle principali formule contrattuali, e dei relativi clausolari integrativi, adottate nell'impresa e sul mercato assicurativo in relazione alla specificità dei rischi assicurati, valutandone le differenze in relazione agli scenari di copertura previsti per l'implementazione del programma assicurativo prescelto"
1375,151375,"Individuare le problematiche dei testi contrattuali valutandone le aree di copertura offerte e le eventuali difficoltà o ambiguità interpretative al fine di elaborare criteri di scelta coerenti con il profilo dei rischi dell'azienda cliente"
1375,101375,"Individuare le principali tecniche di copertura per tipologia di rischio ed i parametri di riferimento essenziali per la stesura contrattuale e il calcolo del premio al fine di determinare i contenuti della proposta o del programma assicurativo aziendale e la disponibilità di mercato alla sottoscrizione degli impegni contrattuali relativi"
1375,51375,"Comparare i testi contrattuali in esame specificando in forma sintetica le differenze in modo da poter effetture scelte tra modelli di copertura alternativi adeguati ai rischi aziendali o da comporre le differenze integrandole in un testo organico"
1374,201374,"Utilizzare gli strumenti informatici di valutazione e rendicontazione del piano assicurativo previdenziale come fonte di informazioni sulla gestione in grado di evidenziare scostamenti o correzioni da operare rispetto ai risultati attesi"
